FORUM;Automotive Finance Financial Services;Las Condes Region Metropolitana Chile;FORUM specializes in automotive financing grants credit and leases to individuals and companies;2024-06-12;100000000;1;Debt Financing;Private;CL;
TipRanks;Analytics Finance Financial Services FinTech SEO Software;Santiago Region Metropolitana Chile;TipRanks is a financial accountability platform that ranks financial advice to assess its accuracy;2024-08-15;80000000;3;Secondary Market;Private;CL;PRYTEK Moneta VC Poalim Equity More Investment House John Nakamura
AVLA;Financial Services Insurance;Las Condes Region Metropolitana Chile;AVLA is an insurance group that provides comprehensive financial solutions for SMEs;2024-01-24;25000000;4;Venture  Series Unknown;Private;CL;responsAbility Investments KFW DEG Barclays Investment Bank Creation Investments Capital Management LLC FinDev Canada
The Wild Foods;Food and Beverage;Santiago Region Metropolitana Chile;The Wild Foods is a FoodTech company that is committed to producing clean nutritious and transparent products;2024-08-24;25000000;3;Series A;Private;CL;Amarena Glisco Partners 30N Ventures
PhageLab;Biotechnology Consulting Enterprise Software Medical Pharmaceutical;Santiago Region Metropolitana Chile;Phage Lab is a laboratory dedicated to animal welfare;2024-01-23;11000000;2;Series A;Private;CL;Collaborative Fund StartUp Chile Nazca Ventures Kevin Efrusy Water Lemon Ventures
Toku;B2C Financial Services FinTech Information Technology Software;Santiago Region Metropolitana Chile;Payments for subscription companies in Latin America;2024-04-16;9300000;4;Series A;Private;CL;Y Combinator FPrime Capital Wollef Ventures Gradient Edward Lando
Botanical Solutions;Agriculture Biotechnology Chemical Farming Manufacturing;Vitacura Region Metropolitana Chile;Botanical Solutions is a startup company that manufactures plantbased active ingredients and products from advanced botanicals;2024-08-20;7600000;5;Series A;Private;CL;The Yield Lab The Yield Lab LATAM Otter Capital The Ganesha Lab Québec
Fintoc;Banking FinTech Mobile Apps Mobile Payments;Santiago Region Metropolitana Chile;Fintoc is an API that lets online businesses accept instant payments coming directly from the customer’s bank account;2024-04-25;7000000;3;Series A;Private;CL;Y Combinator Soma Capital Plug and Play monashees Propel
AgroUrbana;Agriculture AgTech;Santiago Region Metropolitana Chile;Agrourbana is the Vertical Agriculture company;2024-05-18;6000000;4;Series B;Private;CL;Kayyak Ventures Amarena ChileGlobal Ventures Fundación Chile CLIN
Reuse;Marketplace;Santiago Region Metropolitana Chile;Reuse is an endtoend online marketplace for buying and selling refurbished electronics in LATAM;2024-04-27;4500000;2;Seed;Private;CL;IGNIA Dalus Capital AngelHub VC Silence VC Seaya Cathay Latam
SPOT;Analytics Computer Vision Facial Recognition Image Recognition Software;Santiago Region Metropolitana Chile;We provides video analytics as a service to convert videos in capitalizable data;2024-01-15;2000000;7;Seed;Private;CL;StartUp Chile Bridge Latam FEMSA Ventures Kuiper Daedalus Ventures
Movener;Electric Vehicle Environmental Consulting Pollution Control;Santiago Region Metropolitana Chile;Movener is transforming polluting trucks into ecofriendly hybrid trucks;2024-04-26;2000000;1;Venture  Series Unknown;Private;CL;SQM Lithium Ventures
ObraLink;Civil Engineering Construction Information Technology;Providencia Region Metropolitana Chile;ObraLink is a technology service that automates processes and manual tasks in the execution of construction projects;2024-07-02;1929695;4;Seed;Private;CL;Cemex Ventures Carao Ventures Echeverria Izquierdo Polpaico Solutions M10
Keirón;Health Care Information Technology Software;Santiago Region Metropolitana Chile;Keiron is a healthtech focused on digitize the patient journey with and interoperable whitelabel and omnichannel platform;2024-03-04;1700000;3;Seed;Private;CL;Taram Capital Nakama Ventures Consorcio LarrainVial Asset Management
Fracción;ECommerce Health Care Pharmaceutical;Santiago Region Metropolitana Chile;Fracción is an ecommerce platform for pharmacy products;2024-03-21;1700000;2;Undisclosed;Private;CL;Manutara Ventures
Btrust;Financial Services FinTech SaaS;Las Condes Region Metropolitana Chile;Btrust is a SaaS company that provides Supply Chain Finance solutions for corporates and their suppliers;2024-05-17;1500000;2;Seed;Private;CL;Invexor Venture Partners
Webdox;Cloud Data Services Collaboration Contact Management Enterprise Software Information Technology Natural Language Processing Procurement SaaS Software;Santiago Region Metropolitana Chile;Webdox is a SaaS CLM focused on large and medium companies in LATAM and the US;2024-09-13;1500000;8;Venture  Series Unknown;Private;CL;Wayra Kayyak Ventures Taram Capital Asenza Capital Alacrity Ventures
BY BUG;Biotechnology Farming Waste Management;La Serena Coquimbo Chile;We offer an onsite organic waste management service which uses our insectbased biotechnolgy platform to create high valueadded products;2024-07-08;1400000;1;Seed;Private;CL;Atento Capital GRID EXPONENTIAL Arpegio Sudlich Capital Halcyon Venture Partners
Retorna;Apps Financial Services Mobile Payments Transaction Processing;Las Condes Region Metropolitana Chile;Retorna is an application for online money transfers and payments;2024-06-25;1200000;1;Seed;Private;CL;Morro Ventures Amplifica Capital Impacta VC Colectivo Jaguara
Fraccional;Crowdfunding Property Management Real Estate Real Estate Investment;Santiago Region Metropolitana Chile;Fraccional is a real estate investment platform that allows to enter the real estate market for a small charge and earn money;2024-03-01;1000000;2;Seed;Private;CL;
Airnguru SA;Air Transportation Big Data Business Intelligence Information Technology Machine Learning SaaS;Santiago Region Metropolitana Chile;Bestinclass airline pricing intelligence price optimization orchestration and automation platform;2024-03-12;1000000;7;Seed;Private;CL;
FarmaLoop;ECommerce Health Care Medical Pharmaceutical;Santiago Region Metropolitana Chile;FarmaLoop is an online pharmacy which is easy to use platform and innovative prices as per customers requirement;2024-06-05;900000;1;Venture  Series Unknown;Private;CL;Amarena
diio;Analytics Artificial Intelligence (AI) Enterprise Software Sales Enablement;Puerto Varas Los Lagos Chile;Saas Conversation Intelligence;2024-03-18;750000;1;PreSeed;Private;CL;Fen Ventures Salvador Said Cristobal Pinera
Foccuz;Software;Chillan BioBio Chile;Foccuz is a company that provides software solutions for sales teams;2024-03-22;700000;1;Seed;Private;CL;Chile Ventures Kuiper Invariantes Fund CARABELA MGV Capital
Ainwater;Software;Osorno Los Lagos Chile;AIbased SaaS for water treatment plant control and optimization;2024-08-28;537000;1;PreSeed;Private;CL;Arpegio Sudlich Capital Imagine Brian Oduor Buildtech Ventures
Xpendit;FinTech SaaS;Las Condes Region Metropolitana Chile;SaaS B2B for Expense Management in Latin America;2024-01-03;450000;1;PreSeed;Private;CL;Minga Ventures
Relif;FinTech;Santiago Region Metropolitana Chile;Relif is a financial health platform for employees in LatAm;2024-07-18;400000;2;Angel;Private;CL;ChileGlobal Angels
Drovid;Software;Santiago Region Metropolitana Chile;PaaS diseñada para la protección contra incendios forestales mediante el monitoreo de bosques con inteligencia artificial;2024-07-11;350000;6;Nonequity Assistance;Private;CL;Google for Startups CORFO Agencia Nacional de Investigación y Desarrollo Cristian Rodrigo León Ibarra
HRX Talent;Analytics Human Resources Predictive Analytics SaaS;Santiago Region Metropolitana Chile;People Analytics SaaS Platform for Human Resources;2024-05-02;180000;1;Seed;Private;CL;INNZPIRA
ComexPoint;ECommerce Freight Service Insurance Last Mile Transportation Logistics Shipping Software Supply Chain Management Transportation;Viña Del Mar Valparaiso Chile;ComexPoint connects global trade players enabling importers/exporters to choose fair options and know all costs and processes in advance;2024-03-04;160000;1;PreSeed;Private;CL;
Andes Aerospace;Aerospace Embedded Software Hardware Telecommunications;Antofagasta Antofagasta Chile;COTS for satellites and telecommunication systems;2024-04-10;141879;1;Grant;Private;CL;
Credibid;Banking Financial Services Mortgage;Santiago Region Metropolitana Chile;Credibid is a platform that uses an auction method to link consumers and lenders to find acceptable mortgage loan offers;2024-04-01;130000;1;PreSeed;Private;CL;
Salesia;Information Technology Software;Santiago Region Metropolitana Chile;Salesia is an AIdriven sales training platform to improve salespersonclient interactions with simulated experiences and coaching;2024-01-01;100000;1;Angel;Private;CL;
Remote Waters;Manufacturing Solar Water Water Purification;Santiago Region Metropolitana Chile;Remote Waters provides and maintains water purification systems for remote communities with limited access to potable water;2024-01-31;90000;10;Grant;Private;CL;Marcelo Gabor StartUp Chile CORFO SQM Lithium Ventures
Reite;Computer Vision Internet of Things Retail Technology Software;Santiago Region Metropolitana Chile;Reite transforms fridges cabinets and commercial establishments into intelligent and autonomous points of sale through cameras and AI;2024-05-01;80000;2;PreSeed;Private;CL;StartUp Chile
Speaknosis;Health Care Hospital Medical;Santiago Region Metropolitana Chile;HealthCare ambience analytics for Latam;2024-05-01;80000;1;PreSeed;Private;CL;
FlameSense;Web Development;Santiago Region Metropolitana Chile;FlameSenses aim as a working group is to drive change within what is already established utilizing engineering to provide new answers;2024-07-02;50000;1;Angel;Private;CL;Samuel Lira
Queritelcom;Analytics Artificial Intelligence (AI) Crowdsourcing Freelance Market Research SaaS;Las Condes Region Metropolitana Chile;Queritel is a Latam crowdsourced instore data as a service (DAAS) provider;2024-02-08;25000;4;Grant;Private;CL;StartUp Chile VentureOut Parallel18 Greater St Louis Inc
Kalamardigital;AgTech Digital Marketing Machine Learning;Santiago Region Metropolitana Chile;Kalamar is a “ChatGPT“ that creates campaigns for Google or Meta Ads with just a few clicks simultaneously;2024-02-28;15000;1;PreSeed;Private;CL;StartUp Chile